{
  "schemaVersion": "1.0.0",
  "game": {
    "id": "poop-dodge-starter",
    "title": "Poop Dodge Starter",
    "description": "A mobile portrait dodge arcade starter generated by dev_game.",
    "orientation": "portrait",
    "target": "mobile-web"
  },
  "canvas": {
    "width": 1170,
    "height": 2532,
    "backgroundColor": "#0b1024",
    "scaleMode": "fit"
  },
  "player": {
    "moveMode": "drag",
    "speed": 760,
    "hitbox": {
      "width": 42,
      "height": 42
    }
  },
  "hazards": {
    "type": "falling",
    "label": "Poop",
    "spawnRateStart": 900,
    "spawnRateMax": 240,
    "fallSpeedStart": 260,
    "fallSpeedMax": 760,
    "damage": 1,
    "poolSize": 60
  },
  "collectibles": {
    "enabled": true,
    "label": "Coin",
    "spawnRate": 0.28,
    "scoreValue": 50
  },
  "scoring": {
    "survivalPointsPerSecond": 10,
    "collectiblePoints": 50,
    "highScoreLocalStorageKey": "poop_dodge_starter_best"
  },
  "difficulty": {
    "curve": "linear",
    "rampEverySeconds": 15,
    "maxLevel": 12
  },
  "lives": {
    "start": 1,
    "max": 1
  },
  "session": {
    "countdownSeconds": 0,
    "maxDurationSeconds": null
  },
  "theme": {
    "preset": "retro-arcade",
    "colors": {
      "background": "#0b1024",
      "player": "#39e98a",
      "hazard": "#9a5b27",
      "collectible": "#ffd54a",
      "ui": "#ffffff"
    }
  },
  "audio": {
    "enabled": true,
    "sfx": {
      "start": "audio/ui_click.wav",
      "hit": "audio/hit.wav",
      "score": "audio/collect.wav",
      "gameOver": "audio/game_over.wav"
    },
    "music": {
      "gameplay": "audio/game_loop.wav"
    }
  },
  "ui": {
    "showScore": true,
    "showLives": false,
    "showPause": true,
    "showRestart": true
  },
  "performance": {
    "targetFps": 60,
    "objectPooling": true,
    "pauseWhenHidden": true
  }
}
